{
  "id": "effect.mystic.benediction.shield",
  "kind": "effect_definition",
  "displayName": "shield",
  "displayNameKey": "effect.mystic.benediction.shield.display_name",
  "descriptionKey": "effect.mystic.benediction.shield.description",
  "ownerAbilityId": "ability.mystic.benediction",
  "effect": {
    "id": "shield",
    "type": "shield",
    "source": "caster",
    "target": "area",
    "magnitude": {
      "kind": "constant",
      "value": 0
    },
    "duration": 4,
    "tickInterval": 0,
    "stackPolicy": "replace",
    "maxStacks": 1,
    "refreshPolicy": "refresh",
    "removalReason": "expired",
    "tags": [
      "shield",
      "capstone"
    ],
    "school": "heal",
    "healthPercent": 0.1
  },
  "classification": "compile-time-addition",
  "compileTimeAddition": true
}
