{
  "id": "effect.warrior.whirlwind.hit",
  "kind": "effect_definition",
  "displayName": "hit",
  "displayNameKey": "effect.warrior.whirlwind.hit.display_name",
  "descriptionKey": "effect.warrior.whirlwind.hit.description",
  "ownerAbilityId": "ability.warrior.whirlwind",
  "effect": {
    "id": "hit",
    "type": "direct_damage",
    "source": "caster",
    "target": "area",
    "magnitude": {
      "kind": "stat_id",
      "statId": "stat.strength",
      "value": 24,
      "scale": 0.01
    },
    "duration": 0,
    "tickInterval": 0,
    "stackPolicy": "replace",
    "maxStacks": 1,
    "refreshPolicy": "refresh",
    "removalReason": "expired",
    "tags": [
      "melee"
    ],
    "school": "melee"
  },
  "classification": "compile-time-addition",
  "compileTimeAddition": true
}
