{
  "id": "effect.mage.absolute_zero.freeze",
  "kind": "effect_definition",
  "displayName": "freeze",
  "displayNameKey": "effect.mage.absolute_zero.freeze.display_name",
  "descriptionKey": "effect.mage.absolute_zero.freeze.description",
  "ownerAbilityId": "ability.mage.absolute_zero",
  "effect": {
    "id": "freeze",
    "type": "stun",
    "source": "caster",
    "target": "area",
    "magnitude": {
      "kind": "constant",
      "value": 0
    },
    "duration": 4,
    "tickInterval": 0,
    "stackPolicy": "replace",
    "maxStacks": 1,
    "refreshPolicy": "refresh",
    "removalReason": "expired",
    "tags": [
      "freeze",
      "capstone"
    ],
    "school": "spell"
  },
  "classification": "canonical",
  "compileTimeAddition": false
}
