{
  "id": "effect.warrior.unbreakable.dr",
  "kind": "effect_definition",
  "displayName": "dr",
  "displayNameKey": "effect.warrior.unbreakable.dr.display_name",
  "descriptionKey": "effect.warrior.unbreakable.dr.description",
  "ownerAbilityId": "ability.warrior.unbreakable",
  "effect": {
    "id": "dr",
    "type": "timed_stat_modifier",
    "source": "caster",
    "target": "self",
    "magnitude": {
      "kind": "constant",
      "value": 0.5
    },
    "duration": 8,
    "tickInterval": 0,
    "stackPolicy": "replace",
    "maxStacks": 1,
    "refreshPolicy": "refresh",
    "removalReason": "expired",
    "tags": [
      "buff",
      "capstone"
    ],
    "school": "none",
    "statChannel": "damage_reduction"
  },
  "classification": "canonical",
  "compileTimeAddition": false
}
