{
  "id": "effect.mystic.fateweave.harm",
  "kind": "effect_definition",
  "displayName": "harm",
  "displayNameKey": "effect.mystic.fateweave.harm.display_name",
  "descriptionKey": "effect.mystic.fateweave.harm.description",
  "ownerAbilityId": "ability.mystic.fateweave",
  "effect": {
    "id": "harm",
    "type": "direct_damage",
    "source": "caster",
    "target": "primary",
    "magnitude": {
      "kind": "stat_id",
      "statId": "stat.intelligence",
      "value": 20,
      "scale": 0.01
    },
    "duration": 0,
    "tickInterval": 0,
    "stackPolicy": "replace",
    "maxStacks": 1,
    "refreshPolicy": "refresh",
    "removalReason": "expired",
    "tags": [
      "spell",
      "harm"
    ],
    "school": "spell",
    "conditions": [
      {
        "type": "target_relation",
        "relation": "hostile"
      }
    ]
  },
  "classification": "canonical",
  "compileTimeAddition": false
}
