{
  "id": "effect.marksman.coup_de_grace.hit",
  "kind": "effect_definition",
  "displayName": "hit",
  "displayNameKey": "effect.marksman.coup_de_grace.hit.display_name",
  "descriptionKey": "effect.marksman.coup_de_grace.hit.description",
  "ownerAbilityId": "ability.marksman.coup_de_grace",
  "effect": {
    "id": "hit",
    "type": "direct_damage",
    "source": "caster",
    "target": "primary",
    "magnitude": {
      "kind": "stat_id",
      "statId": "stat.agility",
      "value": 70,
      "scale": 0.01
    },
    "duration": 0,
    "tickInterval": 0,
    "stackPolicy": "replace",
    "maxStacks": 1,
    "refreshPolicy": "refresh",
    "removalReason": "expired",
    "tags": [
      "ranged",
      "capstone"
    ],
    "school": "ranged",
    "guaranteedCrit": true,
    "cooldownResetOnKill": true
  },
  "classification": "canonical",
  "compileTimeAddition": false
}
