{
  "id": "effect.marksman.coup_de_grace.reset",
  "kind": "effect_definition",
  "displayName": "reset",
  "displayNameKey": "effect.marksman.coup_de_grace.reset.display_name",
  "descriptionKey": "effect.marksman.coup_de_grace.reset.description",
  "ownerAbilityId": "ability.marksman.coup_de_grace",
  "effect": {
    "id": "reset",
    "type": "cooldown_reset_on_kill",
    "source": "caster",
    "target": "primary",
    "magnitude": {
      "kind": "constant",
      "value": 0
    },
    "duration": 0,
    "tickInterval": 0,
    "stackPolicy": "replace",
    "maxStacks": 1,
    "refreshPolicy": "refresh",
    "removalReason": "expired",
    "tags": [
      "reset"
    ],
    "school": "ranged"
  },
  "classification": "canonical",
  "compileTimeAddition": false
}
